{
  "schemaVersion": "1.0",
  "id": "SAMPLE-001",
  "sequence": 1,
  "workflowStatus": "verified",
  "conclusion": "fix",
  "reason": "규칙 적용성: 적용\n실제 영향: 필수 입력이 없을 때 사용 지점에서 오류가 발생할 수 있습니다.\n안전 전제·미확인: 서비스 직접 호출 경로도 같은 검증을 거쳐야 합니다.\n조치 필요성: 필수\n결론 근거: 사용 전 필수 입력 검증이 실제로 누락됐습니다.",
  "resultFiles": [
    "src/application/ExampleService.ext"
  ],
  "resultSummary": "서비스가 입력을 받는 지점에 필수 입력 검증을 추가했습니다.",
  "resultCodeDiff": "Before: value.use()\nAfter: requireValue(value); value.use()",
  "resultGuideComparison": "보고서가 권고한 사용 전 검증을 이 서비스가 입력을 받는 지점에 적용했습니다.",
  "impact": [
    "확인된 영향: 입력이 없으면 프로젝트의 표준 검증 오류를 반환합니다.",
    "최대 영향 조건: 검증을 우회하는 서비스 직접 호출 경로가 있으면 오류가 상위 흐름으로 전파될 수 있습니다.",
    "잔여 위험: 외부 연동 환경은 이 합성 예시의 검증 범위에 포함되지 않습니다."
  ],
  "verification": {
    "status": "passed",
    "commands": [
      "<프로젝트에서 확인한 대상 테스트 명령>"
    ],
    "results": [
      "입력 누락과 정상 입력의 대상 테스트가 통과했습니다."
    ],
    "limitations": [],
    "verifiedAt": "2026-01-01T01:00:00Z",
    "method": "unit-test"
  },
  "duplicates": [],
  "evidenceNote": "검토 당시 사용 전 검증 누락을 확인하고 필수 조치를 기록한 합성 예시입니다. 입력 누락·정상 입력의 테스트 기록 형식을 보여주며, 소스 스냅샷 연결은 포함하지 않습니다.",
  "updatedAt": "2026-01-01T01:00:00Z"
}
